[
  {
    "schema_version": "1.0.0",
    "finding_id": "FND-SCN-03-REVIEWED-001",
    "assessment_id": "SCN-03-REVIEWED",
    "requirement_ref": "4.1",
    "question_id": "C4-Q01",
    "condition": "No structured evidence was accepted for C4-Q01.",
    "criteria": "ISO/IEC 42001 Clause 4.1 assessment criteria for C4-Q01 require sufficient and traceable supporting evidence.",
    "evidence_refs": [
      {
        "reference_type": "EVIDENCE_DECISION",
        "reference_id": "ED-SCN-03-REVIEWED-001"
      }
    ],
    "risk_statement": "Without sufficient supporting evidence, conformity with requirement 4.1 cannot be demonstrated by this assessment.",
    "severity_preliminary": "MEDIUM",
    "recommendation": "Provide and validate evidence addressing requirement 4.1, then reassess the evidence.",
    "human_disposition": "ACCEPTED",
    "review_record": {
      "reviewer_id": "portfolio-reviewer-001",
      "reviewed_at": "2026-09-04T08:30:00+00:00",
      "disposition": "ACCEPTED",
      "comments": "The absence of a structured context record is confirmed."
    },
    "provenance": {
      "created_at": "2026-09-04T08:30:00+00:00",
      "created_by": "agentic.finding_generator",
      "generator": "DETERMINISTIC_RULES",
      "generator_version": "0.1.0",
      "source_refs": [
        "evidence_decision:ED-SCN-03-REVIEWED-001",
        "question:C4-Q01"
      ]
    }
  },
  {
    "schema_version": "1.0.0",
    "finding_id": "FND-SCN-03-REVIEWED-002",
    "assessment_id": "SCN-03-REVIEWED",
    "requirement_ref": "4.2",
    "question_id": "C4-Q02",
    "condition": "Evidence for C4-Q02 requires human judgement before assessment disposition.",
    "criteria": "ISO/IEC 42001 Clause 4.2 assessment criteria for C4-Q02 require sufficient and traceable supporting evidence.",
    "evidence_refs": [
      {
        "reference_type": "EVIDENCE_DECISION",
        "reference_id": "ED-SCN-03-REVIEWED-002"
      },
      {
        "reference_type": "EVIDENCE",
        "reference_id": "EV-C4-022-draft-interested-parties.txt"
      }
    ],
    "risk_statement": "Automated disposition would exceed the deterministic assessment boundary for requirement 4.2.",
    "severity_preliminary": "REVIEW_REQUIRED",
    "recommendation": "Route the evidence decision to an authorized human reviewer before final disposition.",
    "human_disposition": "MODIFIED",
    "review_record": {
      "reviewer_id": "portfolio-reviewer-001",
      "reviewed_at": "2026-09-04T08:30:00+00:00",
      "disposition": "MODIFIED",
      "comments": "Retain the finding but clarify that a draft register exists and requires approval."
    },
    "provenance": {
      "created_at": "2026-09-04T08:30:00+00:00",
      "created_by": "agentic.finding_generator",
      "generator": "DETERMINISTIC_RULES",
      "generator_version": "0.1.0",
      "source_refs": [
        "evidence_decision:ED-SCN-03-REVIEWED-002",
        "question:C4-Q02",
        "evidence:EV-C4-022-draft-interested-parties.txt"
      ]
    }
  },
  {
    "schema_version": "1.0.0",
    "finding_id": "FND-SCN-03-REVIEWED-003",
    "assessment_id": "SCN-03-REVIEWED",
    "requirement_ref": "4.3",
    "question_id": "C4-Q03",
    "condition": "Evidence for C4-Q03 requires human judgement before assessment disposition.",
    "criteria": "ISO/IEC 42001 Clause 4.3 assessment criteria for C4-Q03 require sufficient and traceable supporting evidence.",
    "evidence_refs": [
      {
        "reference_type": "EVIDENCE_DECISION",
        "reference_id": "ED-SCN-03-REVIEWED-003"
      },
      {
        "reference_type": "EVIDENCE",
        "reference_id": "EV-C4-023-aims-scope.txt"
      }
    ],
    "risk_statement": "Automated disposition would exceed the deterministic assessment boundary for requirement 4.3.",
    "severity_preliminary": "REVIEW_REQUIRED",
    "recommendation": "Route the evidence decision to an authorized human reviewer before final disposition.",
    "human_disposition": "REJECTED",
    "review_record": {
      "reviewer_id": "portfolio-reviewer-001",
      "reviewed_at": "2026-09-04T08:30:00+00:00",
      "disposition": "REJECTED",
      "comments": "The reviewer determined that the supplied scope record resolves the flagged ambiguity."
    },
    "provenance": {
      "created_at": "2026-09-04T08:30:00+00:00",
      "created_by": "agentic.finding_generator",
      "generator": "DETERMINISTIC_RULES",
      "generator_version": "0.1.0",
      "source_refs": [
        "evidence_decision:ED-SCN-03-REVIEWED-003",
        "question:C4-Q03",
        "evidence:EV-C4-023-aims-scope.txt"
      ]
    }
  }
]
